[
  {
    "id": "virtual-1080p-portrait-1",
    "width": 1920,
    "height": 1080,
    "refreshRate": 60,
    "position": { "x": 0, "y": 0 },
    "primary": false
  },
  {
    "id": "virtual-1080p-landscape-1",
    "width": 1920,
    "height": 1080,
    "refreshRate": 60,
    "position": { "x": 1920, "y": 0 },
    "primary": false
  }
]
