[
  {
    "id": "top-left",
    "width": 1920,
    "height": 1080,
    "refreshRate": 60,
    "position": { "x": 0, "y": 0 },
    "primary": true
},
  {
    "id": "top-right",
    "width": 1920,
    "height": 1080,
    "refreshRate": 60,
    "position": { "x": 1920, "y": 0 }
  },
  {
    "id": "bottom-left",
    "width": 1920,
    "height": 1080,
    "refreshRate": 60,
    "position": { "x": 0, "y": 1080 }
  },
  {
    "id": "bottom-right",
    "width": 1920,
    "height": 1080,
    "refreshRate": 60,
    "position": { "x": 1920, "y": 1080 }
  }
]
